content,polarity
@NoilyMV yo soy totalmente puntual,NONE
"@DexterAOM por eso es que se dice lo del final, yo opino igual que usted, tampoco es q sea el final más malo de la historia es regular",NEU
"@robertobrenes Bueno, no es tanto lo mayor como cuánto de campo sea usted. Sos cartaguito en cada aspecto de tu vida, por lo visto.",N
"@doriamdiaz El de Halfon de Germinal se ve mortal. Y los de Mary Jo Bang se fueron volando, pero todavía quedan. En Duluoz hay de Salcedo",P
"Ahorita me van a cambiar las ligas de los brakets, Tengo alfajores argentinos en mi bulto, tengo hambre , ¿QUÉ HAGO? no puedo esperar más",NONE
"El amor es paciente, es bondadoso, no es envidioso ni orgulloso, no es egoísta, no guarda rencor. 1 Corintios 13:4-5 Buen día a todos",P
"El amanecer respirando o2 puro, es más que un regalo... más si es a las 6:00 am frente al mar... preparando la mente con meditación.",P
Acabo de ver una chamaca con un piercing de mota en el ombligo. Lo peor es que tiene cara de que lo que fuma es jamón,N
El sábado se casa Adriel y eso me hace sentir super vieja maee cuando ibamos a pueblo viejo x olafos saliamos fuck off y yo era la niñera,NEU
"@ferrg25 igual uno ya está en el baúl de los recuerdos jajaja y bueno pero no, no conozco a otra solo vi el tweet y me dio gracia",NEU
Hoy tengo 2 preguntas existenciales...1) ¿Por qué hoy esta haciendo TANTO frío? y 2) ¿Porque me volvió a dar hipo después de tantos años?,NONE
@sancarlena77 @frankgrs nunca dije lo contrario,NONE
"""Mae mañana llego a las 10, cuidado te quedas dormida porque a las 10 estoy ahí"" -Liena, se quedó dormida y no ha llegado.",N
"@rociomoram29 que mal y por eso es que están jugando, yo creo q los jugadores viejos o de la casa deberían tener prioridad pero bueno...",N
Parce yo estoy igual @PaisaVlogs,NEU
Gracias a Dios cerrando con broche de oro! Dios siempre dando lo mejor a sus Hijos esta semana fue mucho mejor que la pasada! #thnksGod,P
"@KristelS18 Acá tengo pero ugh, la canela no me gusta mucho es que es que me cae pesado, pero se me quitará.. Gracias Kris.",N
@26Manudo @ldacr yo que lo he visto como 10 veces y me lo sé de memoria jejeje lo siento muy emotivo. Ojalá lo vean y lo vean,P
"Si mañana no entra metales, voy a sentir muy mal a la profe hasta que diga que va a revisar suave y sí pasaría, la profe es toda cosi",P
"@msroucks Wtf Yo tengo mi biblia firmada por el diablo Okno, pero eso es lo que se me vino a la mente :v",NONE
@AnaVM @Katagelon fijo está demasiado hermoso,P
"Viendo Looking, Queers as Folk y así, me doy cuenta que nunca he tenido un grupo de mejores amigos gays. ¿alguien me adopta?",P
"@WillyrexYT y repito: lo siento por no haberte hecho nada hay un gran evento en mi país (La Romería) y no he tenido tiempo, apenas pueda",NEU
Recuerdo cuando le escribía a mi hermana @Andreagraseq79 para que me motivara y me hiciera sentir útil. Dios me dio a la mejor hermana,P
"Hoy inicia la concachampions 2016-2017 pero realmente no importa porque no esta la @ldacr, en todo caso la voy a seguir porque si",N
"Buenos días. Inicio de mes. A darlo todo, aunque sea ""más o menos bueno en algo"". Feliz inicio de semana",P
"Llego a la casa a las 9:20 caminando, no hay comida, todos están dormidos, mañana tengo clases a las 8am, todo esta bien",N
"Lo termine a las 2 am hora Costa Rica, porque se me hizo súper adictivo. Me gusto pero no me encanto #LCshinyforflowers",P
"@byCoba con agua, hielo regularmente para que se mantenga fresca y un poquito de azúcar a la semana, me han durado hasta más de 1 mes.",P
Nos encanta hacerte feliz @rubndu,P
@miguesl21 en estas épocas no hay que decirle no a ningún trofeo y es conmemorativo para todos los equipos que ganen en la jornada,NEU
Y las emergencias? La gente que necesita ir a hospitales? Los que esperan cita desde hace años? Ahhh no! Yo apoyo el paro nacional jijis,N
No voy a poder ver a mi mamá el día de la madre. Por un hijo de la grandísima puta. Bien,N
@lenaychantelle #lelePREGUNTA La cancion de Drive for Miles (Mi Favorita) en que persona fue inspirada Saludos te quiero bye,P
@lenaychantelle Cual es tu helado favorito y comida? Como te parecio Costa Rica cuando viniste y a donde fuiste? Sigueme pls saludos bye,NONE
"Hoy están participando muchas más mujeres, lo que me alegra mucho. Ya sea para preguntas propias o para hacer preguntas por su pareja",P
"@me_aburris Sí he visto q los motociclistas andan especialmente violentos. Le pegan a los carros, los patean, le gritan a la gente y esto",N
"Lo bueno es que voy para Talamanca y Cahuita en una gira, lo malo es que es el finde antes del examen de analítica",NEU
"Mmm no quiero hacer spoiler pero hoy va a ver algo nuevo en el canal,lo podras ver en el nuevo video que subire en unas horas",NEU
"@hugozap quizá para profesionales no sea mucho,pero hay no remunerados principalmente femenino para quienes es un sueño, pasa en mi país",N
X:¿Qué perfume usas? Yo: Victoria's Secret X: Ah yo uso uno de Pink que es más caro que ese!,N
"Hay gente aficionada al fútbol, hay fanáticos, hay envenenados, y hay otros hijueeeeputas necios! Igual que todo en la vida",N
@EsGermanDZ Quiero hacer una pregunta.  Si puedo? Yay.! Bueno la pregunta es.. ¿Vas o irías a un Jóvenes en Victoria?,NONE
"@JArmandoCS ¿Vos también estabas? Ay que triste nombres sí, yo estaba durmiendo, para ir a clase hoy a las 7:30am ¡¡Te extraño bebé!!",N
Delicioso @ San Rafael Ezcazu,P
@Dereck0594 yo tmbn me tienes abandonadisimo,N
"@KhaMoreno hahahaha no lo había visto! Pero ojo, me desperté a las 8 y estoy tratando de dormir no puede ser q ste despierto aún",NEU
"@AnaVM llego tarde, soy huge fan la empecé en el 2000, crecí con ella sube y cae tiene de todo como toda serie, temporadas favoritas...",P
"Me da risa que me digan ""Si es tan amable"" porque no, no soy ""tan amable"", pero diay, que queda.",NEU
"@MicroCoAnSh seamos sinceros: Mi rostro inocente y un: Amigo, no me podés abrir? Es que perdí las llaves y mi roommate no contesta Abre",NONE
"@CotoLau @AndreCorts yo también tuve los libros de AMP y no me convecieron :/, yo pasé los exámenes pero gracias a los exámenes viejos",NEU
@itsdylanjos yo solo las cucas,NONE
"@Starbucks_cr Hola, quería agradecer al personal del Starbucks de La Sabana por guardar mi cartera olvidada Son los mejores, saludos",P
"@Danileivacr buenísimo!! Yo mañana voy a clase de 6 de la tarde que es yoga Dance, es como yoga pero aeróbico",P
"Ya no estoy para andarle sacando conversación a alguien, si la vara fluye bueno, y sino va pa' la mierda.",N
Me cago en la puta,N
@malarodriguez saludos desde Costa Rica mala...ya q siempre te escribo y nunca me respondes Igual nunca me canso de escucharte.. Besos,NEU
@SanzZeriTica El Chavo no estaba triste,P
"Cuando estoy sola,me gusta escuchar los discos de Linkin Park o en cualquier momento,pero mas cuando estoy sola... :v",P
@Varce_c que triste es la realidad,N
"@Calikhaug @PilarAcuna Muy bueno Chiquilla: No hay que tirar piedras al techo del vecino si el tuyo es de cristal. Feliz Noche, Pili.",P
Nada más bonito que ir en bus lleno y que alguien comience a toser como si se le fuera a salir un pulmón,N
@atrejoscr se ve fea en general,N
"@GaboJimenex jajaja. Yo me pegué el susto de la vida, y luego la espera por meterlo al taller de iCon. Pero ya está vivo.",NEU
"@dimar1712 tan linda Diana, muchas gracias vamos a ver cómo me acomodo ahora con trabajo nuevo, cuesta un montón yo te apoyo desde acá!",NEU
"@GrupoPandora y son 30...30 años de acompañarnos,30 es mi edad y he crecido de la mano con ustedes MIL GRACIAS, atte: Ale",P
@AleeSeke ooops cierto. Me mata @raqueabr02,N
Nota Personal: No ver videos de noche sobre youtubers comiendo no ver videos de noche sobre youtubers comiendo no ver videos de noche,N
"Cosas q debemos usar para simplificar nuestra vida: el cerebro, sentido común, una sonrisa y eliminar a quién no nos interesa. Simple",P
@titabobra el viaje de ida fue largo y el bus incomodón. La vuelta en la Peri estuvo muy bien. Y con internet gratis por 20 minutos!,NEU
"UNAM, mil gracias por todo, te prometo en los siguientes 3 años titularme, aunque me haya costado 13 llegar hasta donde estoy hoy",P
"rajado, cuando pasan 16 años te das cuenta que unas cosas cambian si..otras se mantienen para dar tranquilidad en los dias libres",NEU
"@Starbucks_CT Hola , queria preguntarte si el nuevo cafe Chiapas, es el mismo shade grown porque voy a hacer degustacion pronto ...",NONE
"@jkriptos @lmongeb Jajajajajajaja! No, soy la que consume no la que las produce. Saludos Jason que disfrute ese súper viaje.",P
"Mi mamá adoptó una gata que dejaron botada al frente de la casa, si alguien necesita gatos me escriben, tengo 4",NONE
"@rafa514x será que un ""entreno"" es un entrenamiento ""artesanal""? Digo, como ahora todo es ""artesanal""...",N
@ushcala Esa es otra buena idea. Aunque la dinámica de él a sus 9 y la mía esa misma edad es muy distinta.,P
"La vara es que ya tengo como 3 quiz, una eición, dos exámenes, un ensayo, y lo peor es que mis vacaciones ya casi acaban",N
"@xylefTheBarber de comics y de humor negro no y estaré tiempo fuera de youtube, si logro volver es con una idea diferente y cool",NEU
@D4rkusPl4y ah era hoy? mañana durante el día puede llamarme y con mucho gusto a plena luz del día no en lo oscurito en barrios mierda,N
@andreareyes6767 hola odiosa me hace falta,N
Ocupo que den un secret passcode para que las beliebers compren las entradas antes y después las que sobran las ponen a la venta normal,NONE
@AndreaNorieega te tengo compasion tambien,NONE
Me siento triste y solo,N
"Si por aca hay algún chico o una chica mayor de 18 que busca empleo para temporada navideña en tienda, que me ponga un Dm",NONE
"@sancarlena77 JAJAJA. Por cierto, hasta ahorita me percato del username. Y yo preguntando dónde vive. Soy un imbécil. Perdón.",N
"Fijo a esa mae algún famoso le dijo algo, entonces por eso se cree la mas rica y solicitada del puerto, es mi opinión",NEU
No salí el fin de semana porque hoy tenía examen y salgo del examen y nadie quiere ir por una torta chilena,N
@diegodelagos Ayer la gente de mi FB se portó mejor que la de mi TL de TW en relación con el tema de los himnos...,NEU
Bienvenida a los juegos mentales,P
Quiero cambiar de posición el cuarto pero soy tan indecisa que si después no me gusta me voy a sentir mal por una semana,N
@WancitoCubero horrible muy buena pero devastadora,NEU
"No son ni las 9am y aquí estoy a moco tendido, llorando con una pelicula con Cameron Díaz que se le muere la hija",N
"Todos queríamos ver las 2 ticas juntas en la final pero así es esto , ahora le toca a lei q avanza a la final #VISSLAISAworldjuniors",N
@tatisalvaradop Mañana si me duermo en la oficina le cuento para que se sienta culpable *busca el cofal y las pantuflas* Bonita noche,NEU
@luisdbatallar esa tabla es muy reveladora,NONE
Que cargados de odio están tengan se escuchen música abracen salgan de vez en cuando con los suyos y vera como se le quita,N
@FilarmonicaCR ¡Gracias! P.D. Sigan adelante con sus maravillosos trabajos. Quizá algún día un tributo a Soda Stereo jeje,P
"En ""X"" gimnasio me iban a cobrar como 330mil colones en un año. No me matriculé y estoy haciendo las matemáticas para el siguiente viaje",NONE
"@BurodeCreditoMX por curiosidad intenté en 5 bancos distintos y en todos declinado, pero mi reporte está en verde y mi score también",NONE
"Mi consejo de hoy es: Si quieres que esa persona tan especial para ti nunca te olvide, pídele dinero prestado y nunca se lo pagues",NEU
"Soy la peor basura del mundo porque, justo hoy Andrea tenía que verme con otra mujer, que mal me sentí.",N
Me acosté súper tarde ayer (para mis horarios normales) y ahora no puedo seguir durmiendo porque no aguanto el calor de estas horas,N
"Lo mejor que puedo hacer hoy es dormir porque estoy a punto de llorar, no fue mi día en serio.",N
@uiGitsu siempre se aprende algo nuevo,P
¿Será normal este odio-amor con mi hermana? Ni siquiera me respeta Me mandó a lavarme el culo al río lagarto.,N
"Por la mañana hazme saber de tu gran amor, porque en ti he puesto mi confianza. Salmos 143:8 Buen día a todos",P
Bonito cuando pasan a fumigar,N
Ya está listo el puente peatonal por mi casa...ya no tendré que dejar de jugarme la vida cuando voy al auto o al cajero,P
@FranzUgarte @UnAutenticoCule asi tiene que ser .. yo m alegro solo si el barca pierde en algo qe influya a madrid cmo la liga ayer tuani,P
Que rico que es dormir,P
"@H_E_Y ya ahí si no sabría decirte generalmente siempre hace sol temprano, se llega a poner nublado es como luego de las 3pm.",NEU
Yo le escribo a la gente a la hora que sea porque mi ansiedad no me permite esperar a una hora prudente,N
"Mis tenis fueron las primeras en ser compradas y no han llegado todo el mundo con tenis nuevas y yo aquí, zad.",N
"@Frimiralles que delicia, si estuviera más cerca fijo le llego con el tupper. Pero 200 km me separan de su pozol",P
"Esta ceniza me tiene mala ya. Ando con alegría y me arden los ojos, no puedo usar lentes de contacto.",N
"Mañana tengo examen de química e inglés, y aquí estoy acostada, con el celular, conciente de que no se ni que temas me entran",N
"Si por acá hay algun chico o chica mayor de 18, ojalá con eeriencia en tiendas y necesita trabajo para diciembre, que me ponga un Dm",NONE
Buenos días @luisguillermosr. Hace una hora y media salí de Cartago y apenas estoy en Zapote. La gasolina está cara y con presas no rinde,N
@DCBlancoQ o ya lo está hola,NONE
"Entre lo positivo, está el hecho de que no tendré esas responsabilidades extra que adquiría sí yo quedaba electo. Pero mae yo quería",NEU
"Aunque el día no empezó de la mejor manera, queda en uno decidir que tipo de día se quiere vivir.",NEU
Pues que estoy hablando y en eso me sale el lado ñoño que esta dentro de mi todo mal yo hablando de trastornos de personalidad!,N
"Me despierto a las 6 de lo más tranquilo y relajado, me despierto a las 8 y amanezco cansado y enojado",NONE
Mañana se madruga para ir a trabajar a la casi frontera norte. Si puedo me paso y voy por Toñas y tostones,NONE
"@Saramallow los mismso problemas que tenía del otro lado, solo que solo iba un día a la oficina y mi vida era una ilusión",N
Que ahuevado el accidente en Cinchona..,N
"Soy de esos que, aún cuando la comida esté lista y tenga hambre, si no me sirven me da pereza y no como",NONE
mañana hay entrega de trabajo final y yo aquí muy zen desayunando en paz sin tener ni media página escrita... ni las fuentes,NEU
Nos salvamos dos Jonas siempre me vende una sonrisa por 250colones (que siempre es lo único que le falta),P
@luisangelzr fijo tenia un amante bandido esperándola #AsiSon,N
@dankenzon imagínate! Si cuando uno saluda a alguien que está saludando al de atrás se siente feo.. me da miedo ajeno,N
"Días como hoy agradezco no tener carro. Andar con el hígado hinchado por saber esos marchamos, mejor ando en Uber jaja",P
@rogofer1303 voy a ir con un árbol de Navidad en la camisa a taller solo para arruinar su día,N
"Siempre que veo pasar deprisa a una ambulancia de soporte avanzado, se me hace un nudo en la garganta y me vienen malos recuerdos",N
"@LaEscude Sí, a mí también me gustó mucho, pero como todos esfuerzos sociales de Google, el problema es crearles volumen de usuarios.",N
Hoy es el concierto de Metallicaaaa!!! Uuuuhhh... lástima que no voy la wea triste,NONE
Chema en esas y todos en la oficina deseando que vuelva a la oficina y a dirigir la empresa mejor...,P
"Cuando no sepas que hacer nada mas hagarra tu celular, unos audifonos y despeja tu mente!",P
"De hoy en ocho nos dan las camisas de undécimo, y yo ni sé si voy a lograr sobrevivir a la semana de trimestrales",N
Llevo más de una semana lesionada,N
@leonardodiazpor sos mi James gordeon favorito...,P
"En una propuesta/solicitud de servicio lo que debe quedar muy claro son los ENTREGABLES. Si esto no está claro, habrá problemas.",NONE
"@Ka_Arroyo_ y cómo mezclan realidad con mundos paralelos, y que es diferente a las demás películas de Marvel",P
@ReyDeLosBullies La quiero aniquilar. Desgraciada.,N
Yo hasta ahora veo el vídeo del pingüino no lo puedo creer. ¿Es normal que esté tan triste? Díganme que ustedes también lloraron.,N
"este fin semana consistió en 12 horas de viaje a la zona indígena en Kachabri, Talamanca y a Cahuita",NONE
@Natticornia @YouNow ya volvió a esas mierdas porque no tiene a show de huevos es un día triste para el hombre araña...,N
Con lo que voy a gastar comprándome algo para halloween me compro una mudada y de paso la entrada en 5 mil,N
Acabo de recordar que existen los queques navideños y ya casi es diciembre para verlos por todo lado,P
"@MonumentalCR buenos días, coronado frío y nublado, deseándoles un feliz día y que está navidad este llena de amor",P
@Javi_Guerrero97 vas a ser un gran comunicador,P
Princesa hermosa  Estas creciendo muy rápido Te Amo pequeña de tía,P
"Voy a ver Armaggedon. Qué cinta rajado, muchas gracias a la persona que me la recomendó",P
Tengo una leve duda de que las fotos del meet acá en CR las van a plublicar hasta el año que viene,N
"@Koalasoy es una teja ese cabrón. Si en el programa se ve agradable, en la vida real es el doble de buena gente.",P
Sospechosa tarde navideña de octubre... #grinch,N
Ya me quedé sin wifi y qué flojera levantarme a encenderlo de nuevo mi mamá que no me quiere ;_;,N
"Se nos está volviendo costumbre del domingo por la noche, ver el episodio anterior de SNL y eso me hace recibir el lunes en un mejor mood",P
"@MeLlamoSara @bichoclarke @gabmmd los de cuero,papel y tijera. Que tenía uno visto desde hace dos semanas y le subieron el precio",N
"@sinceratops no me dijo nada nuevo, tranqui jaja. Si ve más bolsos lindos me los recomienda también, porfa",NEU
"La típica que nunca ha dicho la palabra ""picha"", siempre se la ha ""comido"".",N
Hay un grupo de estudio religioso en el sótano y están haciendo un bullón increíble. Yo sólo quiero ver mi película de putas,N
Es bonito tener orden en la vida; solamente hay que aprender y acostumbrarse a poner las cosas y a las personas en su lugar,P
"...para regalar. Así que si alguien está interesado pueden buscarlo tipo 12md cerca de la plaza de la cultura, donde suele estar.",NONE
"@treledo Ya pude ver la info, el hoario es de 7.30 a 4, no tenía idea de que se podía solicitar digital, gracias",NONE
"Era a la 6 que me quería levantar, no a las 5:15 con el ruido de una hijueputa licuadora gracias al descerebrado de mi primo",N
"@emiliegonzalez eso es de Grammar 1, no de inglés 7! de Inglés 7 yo hice resumen el cuatri pasado",NONE
@NellaZ Listo! Muchas gracias Nella,NONE
"Si Cofal o Zepol necesitan influenciadores en digital, hoy, después del pichazo que me pegué, yo podría ser uno.",N
No me han llegado mis películas de cine clásico que pedí así que veré algo básico como The Purge: El año de la elección,NONE
"Hoy a Santi se le rego el pichel lleno de fresco, y yo parecia Senicienta por todo el piso JAJAJ",NONE
"@fermeade Gracias a ti hoy soy muy feliz Descansa, que sueñes bonito. Te quiero un montón",P
Que feo estar sin celular,N
"Los recuerdos más importantes y los mejores vividos se quedan en el alma, más en cualquier otra cosa son borrables",NEU
@JaenRodz jaja gracias igual mido 1.55,NONE
Erito es una mala persona,N
"Cuando salga de exámenes me voy a meter al gimnasio y voy a tener un cuerpo lindo, y ahí es cuando voy a ser feliz",P
"New Balance podría dejar de ser el patrocinador de la Sele o sea, camisetas feas otra vez",N
"""El fútbol es 11 contra 11 durante 90 min, pero al final gana Alemania"" #ApagueyVamonos @DFB_Team @DFB_Team_EN #PuraVida",P
"@MonumentalCR buenos días, último día laboral, me voy a vacaciones una semana. Éxitos en sus vidas y que sean muy felices",P
"@Pandax14Cr @D4rkusPl4y si va comer gallina mejor quedese calladito, tomese sus pastillitas y siga echandole el cuento a youtubers",N
"@Chepe_Centro bueno no es tan mala, tiene muuuchos elementos de las primeras dos películas (eso es lo mejor) y le agregan otros nuevos",P
Mi profe de comunicación se parece a la profesora Umbridge. Yo sé que en el fondo es malvada y nos quiere ver quedarnos.,N
Que me han dicho tantas veces odiosa que a veces creo que si lo soy pero naaah soy un amor,NEU
Ahora que trabajo tiempo completo me siento tan merecedora de los viernes como que tengo derecho a cantar The Cure (,P
@GloryPB Las maniaticas son lo mas divertidas,P
Ya casi me quitan los frenillos y no quiero aún los siento feos. Los necesito al menos un año más,N
En otros temas y aparte: la vida da muchas vueltas que curioso como cambian algunas cosas,NEU
"@H_E_Y qué injusticia, yo no sabía guardadas porque no las quería arruinar.. y se me dañan en la siguiente puesta",N
"Chiky en todos los eventos me dice ""Mae échame a una amiga tuya"" y nunca le he cumplido, soy una mala mejor amiga",N
"Mañana debuto en percusión para leones chinos, ya puedo dejar de ser una samulnorian frustrada. Aunque el traje de Samulnori es más lindo",NEU
"@mhariprada Por lo menos lo tenes ahí. No me acuerdo la última vez que yo vi al mío (amo esa canción, btw)",NEU
@PazBloise A mi me operan el lunes las 4 y leer esto es muy poco alentador Que sigas mejor,N
"@Christ_Campos06 júrelo que lo reconsidero siempre, tengo insomnio y la ansiedad no me deja dormir + tengo e mañana",N
@ilejarza ¡Es el mejor! Espero con emoción ese disco nuevo y deseo tener tiempo para digerir toda la discografía antes de morir.,P
Ese momento en que vas camino a una despedida de soltero y te das cuenta que ya sos adulto,N
El amor no dura para siempre,N
De nuevo quiero dedicarme solo a ser groomer y pasear perros. No saben la felicidad que me trae.,P
"@marielabrenesv Ah entonces a ver primero Stranger Things, además que son menos episodios. Voy a ver si la empiezo ya",NONE
"@KamilaR94 i told you mi batería es un ridículo, un 10% dura 5 minutos ahora. necesito que arreglen esto ya",N
@pamearcep Esa es la respuesta correcta jaja,P
"@Caf3consal mas o menos me pasa igual, salgo de Liberia a las 4:30 y llego tipo 10 a descansar",NONE
Estoy en mi casa encerrada en el carro con musica full cuando debería de estar en algún lado,N
"@JPR_CR con azúcar??? jaja yo solo con sal y limón, a veces le echo un poquito de Chile",NONE
"@DuardoQO jajajaja, es invitación abierta, el único requisito es ser del TEC y ser tuitero.",P
"@libadri perfecto. ¡Gracias! A ver cuánto me toca pagar este año, que ya 3 años he pagado lo mismo.",N
"Primer vez en años que no tengo plan de Halloween, difraz, nada... solo quiero terminar de estudiar rápido y ver el partido",NEU
"#Windows10 qué mal me caes... @Microsoft Para abrir cualquier navegador o aplicación es tan lento, torpe e ineficiente que da pavor",N
"@presenteausente *suspira* puse picadillo de chayote con molida y maiz dulce, arroz con frijoles, y un bistec, así a lo sencillo",NONE
Apoyen a la Network @MCRoyalPvP !! Esta network tiene futuro !! P hare videos y directos ahi cuando habran,P
Lo que extraño de no vivir con mi tia es que ya no puedo ir a la playa o de peda con mis primos favs,NONE
"Si me hubieran pagado el viernes estaría fuertemente de fiesta, pero no aquí estoy acostado en mi cama como 168 colones en la tarjeta",N
@JosePB17 su mamá va??? Yo también voy . Pero fijo ya ella no se acuerda de mi y yo soy distraida,NONE
Juro que todo lo veo borroso,N
"La vez pasada hice una amiga de baño en el Club. Se llamaba Naomi. Saludos Naomi, te tengo presente.",P
1 minuto de silencio por los que trabajamos en horario de Mall y no podemos ver el clásico,N
"@LuisRonaldMesen @amy_arom es simple! Mejor no arriesgarse, el q la consuma q la disfrute, yo mejor paso y ya",NEU
Yo no sé ustedes pero mi mejor amigo al chile es EL mejor amigo y lo extraño #zad,NEU
@Javiercd18 Jajaja es que te pones a buscar defectos en una buena iniciativa de redes Yo también te quiero y me haces falta.,P
"@Emilio_Botas cuidado y se enamora de la suegra, porque vieras que señora y que mano tiene para la cocina, y dicen qe panza llena corazón",P
"Entre todas las miles de personas a las que le podía haber pasado eso, ME PASA A MI -.-'",N
millennial memorial: cambiar contraseña wifi con el nombre del gatito amigo de boabdil que se acaba de morir,NEU
"Regalo hermano menor tiene 16 está en plena adolescencia y es insoportable, el que lo acepte lo invito a comer",N
"No me niegues, Señor, tu misericordia; que siempre me protejan tu amor y tu verdad. Salmos 40:11 Buen día a todos",P
Me siento más ignorada que de costumbre lo bueno es que soy estudiante universitaria y en vez de lamentarme puedo aprovechar el tiempo,P
"2:12 am, está semana he dormido 17 horas, hago examen de química a las 8 am y salgo del brete a las 10 pm",NONE
"@Phoenix2124 si si, prendieron fuego !! La única que me sabía la cantaron cuando estaba haciendo fila en el baño 1 gusto conocerte!!",P
Entró a trabajar a la 1:30 p.m y yo en San Carlos Mi tío cree que voy a llegar puntual.,NONE
Yo que podría decir de mi ex? Fui demasiado feliz y me hizo crecer como persona,P
"Digamos, muy bonito todo, un día super chuzo, todo divino pero mi crush no me dijo feliz cumple",N
"@gabrielselva_cr ahí estaba, bueno en el descanso no, me fui a mojar hasta los palcos del frente para hablar con los privados de libertad",NONE
"@_Star_Vader Si, no hay que perder la esperanza jaja, digamos tuve muchas eectativas con alguien pero no se dio y tome por gordo",P
Clinton ganó voto popular y Trump el colegio electorado. Adivinen quién es presidente electo,NONE
